{
  "calendar": "gregorian",
  "captureSource": "app",
  "contractVersion": 1,
  "controlByteCount": 4096,
  "createdAtEpochMilliseconds": 1700000000000,
  "invocation": {
    "locationOutcome": "notRequested",
    "originRecordingID": null,
    "sequence": 1
  },
  "locale": "en-US",
  "observations": [
    {
      "kind": "candidateOccupancy",
      "logicalPaths": [
        [
          "Synthetic Vault",
          "Inbox",
          "capture.md"
        ]
      ],
      "observationID": "44444444-4444-4444-8444-444444444444",
      "orderedSetHash": "1111111111111111111111111111111111111111111111111111111111111111",
      "status": "present"
    },
    {
      "byteStreamID": null,
      "kind": "frozenTemplate",
      "length": 0,
      "observationID": "55555555-5555-4555-8555-555555555555",
      "sha256": "0000000000000000000000000000000000000000000000000000000000000000",
      "status": "absent"
    },
    {
      "byteStreamID": "88888888-8888-4888-8888-888888888888",
      "kind": "existingNote",
      "length": 25,
      "logicalPath": [
        "Synthetic Vault",
        "Inbox",
        "capture.md"
      ],
      "observationID": "66666666-6666-4666-8666-666666666666",
      "sha256": "2222222222222222222222222222222222222222222222222222222222222222",
      "status": "present"
    },
    {
      "assets": [
        {
          "length": 32,
          "mediaType": "audio/wav",
          "sha256": "1111111111111111111111111111111111111111111111111111111111111111",
          "sourceID": "66666666-6666-4666-8666-666666666666"
        }
      ],
      "kind": "stagedAssetMetadata",
      "observationID": "77777777-7777-4777-8777-777777777777",
      "orderedSetHash": "3333333333333333333333333333333333333333333333333333333333333333",
      "status": "present"
    }
  ],
  "operation": "newNote",
  "payloads": [
    {
      "id": "22222222-2222-4222-8222-222222222222",
      "kind": "text",
      "text": "Synthetic capture text."
    },
    {
      "id": "44444444-4444-4444-8444-444444444444",
      "kind": "link",
      "label": "Synthetic link",
      "url": "https://example.invalid/synthetic"
    },
    {
      "id": "55555555-5555-4555-8555-555555555555",
      "kind": "asset",
      "length": 32,
      "mediaType": "audio/wav",
      "originalNamePolicy": "discard",
      "safeExtension": "wav",
      "sha256": "1111111111111111111111111111111111111111111111111111111111111111",
      "sourceID": "66666666-6666-4666-8666-666666666666"
    }
  ],
  "pins": {
    "coreVersion": "vox-core-contract-only",
    "modelProfileID": null,
    "modelRevision": null,
    "profileID": "apple-parity-v1",
    "profileVersion": 1,
    "rendererRevision": "swift-legacy-m0"
  },
  "preparationRevision": 1,
  "preset": {
    "destinationPolicy": {
      "capabilityClass": "userVault",
      "capabilityReference": "synthetic-vault-capability",
      "expectedCaseSensitivity": "unknown"
    },
    "id": "33333333-3333-4333-8333-333333333333",
    "metadataPolicy": {
      "finalNewline": true,
      "frontmatterMode": "merge",
      "lineEnding": "lf",
      "orderedFields": [
        {
          "name": "source",
          "value": "synthetic"
        }
      ],
      "templatePolicy": "frozenObservation"
    },
    "retryMarkerPolicy": "voxCaptureCommentV1",
    "revision": 7,
    "routePolicy": {
      "attachmentFolder": [
        "Assets"
      ],
      "collisionPolicy": "reuseIfHashMatches",
      "extensionPolicy": "markdownDotMd",
      "logicalFolder": [
        "Synthetic Vault",
        "Inbox"
      ],
      "noteNameTemplate": "capture-{id}.md"
    },
    "snapshotHash": "0000000000000000000000000000000000000000000000000000000000000000",
    "templateFreezePoint": "firstPreparation"
  },
  "requestID": "11111111-1111-4111-8111-111111111111",
  "session": {
    "inputOrdering": "observation-list-then-sequence",
    "maximumAggregateObservationBytes": 268435456,
    "maximumChunkBytes": 1048576,
    "singleFinalize": true,
    "singleSeal": true
  },
  "snapshotHash": "0000000000000000000000000000000000000000000000000000000000000000",
  "timezone": "America/Los_Angeles"
}
